drop table if exists t1;
CREATE TABLE t1(
id INT NOT NULL AUTO_INCREMENT,
json_col JSON,
PRIMARY KEY(id)
);
INSERT INTO  t1 (json_col) VALUES ('{"City": "BeiJing", "Description": "Beautiful City"}');
SELECT * FROM t1;
id	json_col
1	{"City": "BeiJing", "Description": "Beautiful City"}
INSERT INTO t1(json_col) VALUES('{"opening":"Sicilian","variations":["pelikan","dragon","najdorf"]}');
UPDATE t1 SET json_col=JSON_ARRAY_APPEND(json_col,'$.variations','scheveningen') WHERE id = 2;
SELECT * FROM t1;
id	json_col
1	{"City": "BeiJing", "Description": "Beautiful City"}
2	{"opening": "Sicilian", "variations": ["pelikan", "dragon", "najdorf", "scheveningen"]}
ADMIN CHECK TABLE t1;

drop table if exists jemp;
CREATE TABLE jemp (
c JSON,
g INT GENERATED ALWAYS AS (c->"$.id"),
INDEX i (g)
);
INSERT INTO jemp (c) VALUES
('{"id": "1", "name": "Fred"}'), ('{"id": "2", "name": "Wilma"}'),
('{"id": "3", "name": "Barney"}'), ('{"id": "4", "name": "Betty"}');
SELECT c->>"$.name" AS name  FROM jemp WHERE g > 2;
name
Barney
Betty
EXPLAIN SELECT c->>"$.name" AS name
FROM jemp WHERE g > 2;
id	estRows	task	access object	operator info
Projection_4	3333.33	root		json_unquote(cast(json_extract(json.jemp.c, $.name), var_string(16777216)))->Column#4
└─Selection_7	3333.33	root		gt(json.jemp.g, 2)
  └─TableReader_6	10000.00	root		data:TableFullScan_5
    └─TableFullScan_5	10000.00	cop[tikv]	table:jemp	keep order:false, stats:pseudo
SHOW WARNINGS;
Level	Code	Message
ADMIN CHECK TABLE jemp;

drop table if exists jemp;
CREATE TABLE jemp (
`id` int(10) unsigned NOT NULL AUTO_INCREMENT,
`category` JSON,
`tags` JSON,
PRIMARY KEY (`id`)
);
SHOW FULL COLUMNS from jemp;
Field	Type	Collation	Null	Key	Default	Extra	Privileges	Comment
id	int(10) unsigned	NULL	NO	PRI	NULL	auto_increment	select,insert,update,references	
category	json	NULL	YES		NULL		select,insert,update,references	
tags	json	NULL	YES		NULL		select,insert,update,references	
INSERT INTO `jemp` (category, tags) VALUES ('{"id": 1, "name": "TiDB"}', '[1, 2, 3]');
INSERT INTO `jemp` (category, tags) VALUES (JSON_OBJECT("id", 2, "name", "pingcap.com"), JSON_ARRAY(1, 3, 5));
SELECT * FROM jemp;
id	category	tags
1	{"id": 1, "name": "TiDB"}	[1, 2, 3]
2	{"id": 2, "name": "pingcap.com"}	[1, 3, 5]
SELECT id, category->'$.id', category->'$.name', tags->'$[0]', tags->'$[2]' FROM jemp;
id	category->'$.id'	category->'$.name'	tags->'$[0]'	tags->'$[2]'
1	1	"TiDB"	1	3
2	2	"pingcap.com"	1	5
SELECT id, category->'$.name', JSON_UNQUOTE(category->'$.name'), category->>'$.name' FROM jemp;
id	category->'$.name'	JSON_UNQUOTE(category->'$.name')	category->>'$.name'
1	"TiDB"	TiDB	TiDB
2	"pingcap.com"	pingcap.com	pingcap.com
SELECT * FROM jemp WHERE category = '{"id": 1, "name": "TiDB"}';
id	category	tags
SELECT * FROM jemp WHERE category = CAST('{"id": 1, "name": "TiDB"}' as JSON);
id	category	tags
1	{"id": 1, "name": "TiDB"}	[1, 2, 3]
SELECT * FROM jemp WHERE category->'$.name' = 'pingcap.com';
id	category	tags
2	{"id": 2, "name": "pingcap.com"}	[1, 3, 5]
SELECT * FROM jemp WHERE category->>'$.name' = 'pingcap.com';
id	category	tags
2	{"id": 2, "name": "pingcap.com"}	[1, 3, 5]
SELECT * FROM jemp WHERE category->'$.id' = '1';
id	category	tags
SELECT * FROM jemp WHERE category->'$.id' = 1;
id	category	tags
1	{"id": 1, "name": "TiDB"}	[1, 2, 3]
SELECT * FROM jemp WHERE JSON_CONTAINS(category, '1', '$.id');
id	category	tags
1	{"id": 1, "name": "TiDB"}	[1, 2, 3]
SELECT * FROM jemp WHERE JSON_CONTAINS(tags, '2');
id	category	tags
1	{"id": 1, "name": "TiDB"}	[1, 2, 3]
UPDATE jemp SET category = JSON_INSERT(category, '$.name', 'google', '$.url', 'www.google.hk') WHERE id = 1;
DROP TABLE IF EXISTS D_21104470;
CREATE TABLE D_21104470 (
pk int(11) NOT NULL AUTO_INCREMENT,
col_int_nokey json NOT NULL,
col_int_key int(11) NOT NULL,
col_date_key date NOT NULL,
col_date_nokey json NOT NULL,
col_time_key time NOT NULL,
col_time_nokey json NOT NULL,
col_datetime_key datetime NOT NULL,
col_datetime_nokey json NOT NULL,
col_varchar_key varchar(1) NOT NULL,
col_varchar_nokey json NOT NULL,
PRIMARY KEY (pk),
KEY col_int_key (col_int_key),
KEY col_date_key (col_date_key),
KEY col_time_key (col_time_key),
KEY col_datetime_key (col_datetime_key),
KEY col_varchar_key (col_varchar_key),
KEY col_int_key_2 (col_int_key,col_date_key,col_time_key,col_datetime_key,col_varchar_key)
) AUTO_INCREMENT=11 DEFAULT CHARSET=latin1;
INSERT INTO D_21104470
VALUES
(1,'{"int1": "6"}',3,
'2007-06-18','{"date": "2007-06-18"}',
'00:00:00','{"time": null}',
'2002-08-20 22:48:00','{"datetime": "2002-08-20 22:48:00.035785"}',
'd','{"varc": "d"}'),
(2,'{"int1": "2"}',8,
'2002-10-13','{"date": "2002-10-13"}',
'00:00:00','{"time": "00:00:00"}',
'1900-01-01 00:00:00','{"datetime": "1900-01-01 00:00:00"}',
's','{"varc": "s"}'),
(3,'{"int1": "4"}',1,
'1900-01-01','{"date": "1900-01-01"}',
'15:57:25','{"time": "15:57:25.019666"}',
'2005-08-15 00:00:00','{"datetime": "2005-08-15 00:00:00"}',
'r','{"varc": "r"}'),
(4,'{"int1": "8"}',8,
'1900-02-03','{"date": null}',
'07:05:51','{"time": "07:05:51.006712"}',
'1900-01-01 00:00:00','{"datetime": "1900-01-01 00:00:00"}',
'm','{"varc": "m"}'),
(5,'{"int1": "4"}',8,
'2006-03-09','{"date": "2006-03-09"}',
'19:22:21','{"time": "19:22:21.057406"}',
'2008-05-16 08:09:06','{"datetime": "2008-05-16 08:09:06.002924"}',
'b','{"varc": "b"}'),
(6,'{"int1": "4"}',5,
'2001-06-05','{"date": "2001-06-05"}',
'03:53:16','{"time": "03:53:16.001370"}',
'2001-01-20 12:47:23','{"datetime": "2001-01-20 12:47:23.022022"}',
'x','{"varc": "x"}'),
(7,'{"int1": "7"}',7,
'2006-05-28','{"date": "2006-05-28"}',
'09:16:38','{"time": "09:16:38.034570"}',
'2008-07-02 00:00:00','{"datetime": "2008-07-02 00:00:00"}',
'g','{"varc": "g"}'),
(8,'{"int1": "4"}',5,
'2001-04-19','{"date": "2001-04-19"}',
'15:37:26','{"time": "15:37:26.028315"}',
'1900-01-01 00:00:00','{"datetime": "1900-01-01 00:00:00"}',
'p','{"varc": "p"}'),
(9,'{"int1": "1"}',1,
'1900-01-01','{"date": "1900-01-01"}',
'00:00:00','{"time": "00:00:00"}',
'2002-12-08 11:34:58','{"datetime": "2002-12-08 11:34:58.001571"}',
'q','{"varc": "q"}'),
(10,'{"int1": "9"}',6,
'2004-08-20','{"date": "2004-08-20"}',
'05:03:03','{"time": "05:03:03.047452"}',
'1900-01-01 00:00:00','{"datetime": "1900-01-01 00:00:00"}',
'w','{"varc": "w"}');
DROP TABLE IF EXISTS DD_21104470;
CREATE TABLE DD_21104470 (
pk int(11) NOT NULL AUTO_INCREMENT,
col_int_nokey json NOT NULL,
col_int_key int(11) NOT NULL,
col_date_key date NOT NULL,
col_date_nokey json NOT NULL,
col_time_key time NOT NULL,
col_time_nokey json NOT NULL,
col_datetime_key datetime NOT NULL,
col_datetime_nokey json NOT NULL,
col_varchar_key varchar(1) NOT NULL,
col_varchar_nokey json NOT NULL,
PRIMARY KEY (pk),
KEY col_int_key (col_int_key),
KEY col_date_key (col_date_key),
KEY col_time_key (col_time_key),
KEY col_datetime_key (col_datetime_key),
KEY col_varchar_key (col_varchar_key),
KEY col_int_key_2 (col_int_key,col_date_key,col_time_key,col_datetime_key,col_varchar_key)
) AUTO_INCREMENT=20 DEFAULT CHARSET=latin1;
INSERT INTO DD_21104470
VALUES
(10,'{"int1": "6"}',3,
'2002-12-16','{"date": "2002-12-16"}',
'17:54:20','{"time": "17:54:20.050299"}',
'2007-04-06 06:20:37','{"datetime": "2007-04-06 06:20:37.035492"}',
'i','{"varc": "i"}'),
(11,'{"int1": "1"}',1,
'2005-08-08','{"date": "2005-08-08"}',
'08:53:47','{"time": "08:53:47.064602"}',
'2008-03-07 00:00:00','{"datetime": "2008-03-07 00:00:00"}',
'x','{"varc": "x"}'),
(12,'{"int1": "5"}',2,
'2004-11-16','{"date": "2004-11-16"}',
'01:40:28','{"time": "01:40:28.015719"}',
'2002-01-25 10:15:08','{"datetime": "2002-01-25 10:15:08.014682"}',
'l','{"varc": "l"}'),
(13,'{"int1": "6"}',7,
'1900-02-04','{"date": null}',
'16:37:21','{"time": "16:37:21.055310"}',
'2001-02-26 23:35:13','{"datetime": "2001-02-26 23:35:13.014897"}',
'q','{"varc": "q"}'),
(14,'{"int1": "2"}',6,
'2006-05-14','{"date": "2006-05-14"}',
'01:00:33','{"time": "01:00:33.038177"}',
'2001-06-23 13:47:43','{"datetime": "2001-06-23 13:47:43.001775"}',
'n','{"varc": "n"}'),
(15,'{"int1": "4"}',1,
'2005-01-19','{"date": "2005-01-19"}',
'03:06:43','{"time": "03:06:43.059217"}',
'2007-01-17 05:06:55','{"datetime": "2007-01-17 05:06:55.064405"}',
'r','{"varc": "r"}'),
(16,'{"int1": "231"}',156,
'1900-01-01','{"date": "1900-01-01"}',
'00:00:00','{"time": null}',
'2001-10-23 00:00:00','{"datetime": "2001-10-23 00:00:00"}',
'c','{"varc": "c"}'),
(17,'{"int1": "4"}',8,
'2004-06-25','{"date": "2004-06-25"}',
'16:13:44','{"time": "16:13:44.008978"}',
'2003-11-24 04:13:27','{"datetime": "2003-11-24 04:13:27.046820"}',
'h','{"varc": "h"}'),
(18,'{"int1": "3"}',7,
'2009-12-22','{"date": "2009-12-22"}',
'14:09:13','{"time": "14:09:13.028533"}',
'2007-09-19 14:33:09','{"datetime": "2007-09-19 14:33:09.017132"}',
'k','{"varc": "k"}'),
(19,'{"int1": "3"}',2,
'2004-06-25','{"date": "2004-06-25"}',
'10:09:51','{"time": "10:09:51.017335"}',
'1900-01-01 00:00:00','{"datetime": "1900-01-01 00:00:00"}',
't','{"varc": "t"}');
drop table if exists t,blobs,tinyblobs,mediumblobs,longblobs,year,varbin,bin,enum,sett,varchar_binary;
create table t(c varchar(30) not null, j json, key(c));
create table blobs(b blob);
 insert into blobs values(x'cafebabe');
create table tinyblobs(b tinyblob);
 insert into tinyblobs values(x'cafebabe');
create table mediumblobs(b mediumblob);
 insert into mediumblobs values(x'cafebabe');
create table longblobs(b longblob);
 insert into longblobs values(x'cafebabe');
create table year(y year);
 insert into year values('1992');
create table varbin(b varbinary(40));
 insert into varbin values(x'cafebabe');
create table bin(b binary(40));
 insert into varbin values(x'cafebabe');
create table enum(e enum('a', 'b', 'c'));
 insert into enum values ('b');
create table sett(e set('a', 'b', 'c'));
 insert into sett values ('b,c');
create table varchar_binary(c varchar(30) character set 'binary');
 insert into varchar_binary values ('foo');
insert into t values ('null'            ,'null');
insert into t values ('bool'            ,'true');
insert into t values ('uint'            ,cast(cast(12 as unsigned) as json));
insert into t values ('int'             ,'12');
insert into t values ('double'          ,cast(3.14E0 as json));
insert into t values ('stringany'       ,'"a"');
insert into t values ('stringint'       ,'"1"');
insert into t values ('stringdecimal'   ,'"3.14"');
insert into t values ('object'          ,'{"a": 3}');
insert into t values ('array'           ,'[1,2]');
insert into t values ('opaque_mysql_type_decimal'  ,cast(3.14 as json));
insert into t values ('opaque_mysql_type_date'     ,cast(cast('2015-01-15' as date) as json));
insert into t values ('opaque_mysql_type_time'     ,cast(cast('23:24:25' as time) as json));
insert into t values ('opaque_mysql_type_datetime' ,cast(cast('2015-01-15 23:24:25' as datetime) as json));
insert into t(c,j) (select 'opaque_mysql_type_year',cast(y as json) from year);
insert into t(c,j) (select 'opaque_mysql_type_varbinary' ,NULL);
insert into t(c,j) (select 'opaque_mysql_type_binary' ,NULL);
insert into t(c,j) (select 'opaque_mysql_type_string' ,NULL);
insert into t values ('opaque_mysql_type_var_string' ,NULL);
drop table if exists t,blobs,tinyblobs,mediumblobs,longblobs,year,varbin,bin,enum,sett,varchar_binary;
