DROP TABLE IF EXISTS t;
CREATE TABLE t (
c1 date,
c2 datetime,
c3 timestamp,
c4 time,
c5 year
);
SHOW CREATE TABLE t;
Table	Create Table
t	CREATE TABLE `t` (
  `c1` date DEFAULT NULL,
  `c2` datetime DEFAULT NULL,
  `c3` timestamp NULL DEFAULT NULL,
  `c4` time DEFAULT NULL,
  `c5` year(4) DEFAULT NULL
) ENGINE=InnoDB DEFAULT CHARSET=utf8mb4 COLLATE=utf8mb4_bin
SHOW COLUMNS FROM t;
Field	Type	Null	Key	Default	Extra
c1	date	YES		NULL	
c2	datetime	YES		NULL	
c3	timestamp	YES		NULL	
c4	time	YES		NULL	
c5	year(4)	YES		NULL	
SHOW FULL COLUMNS FROM t;
Field	Type	Collation	Null	Key	Default	Extra	Privileges	Comment
c1	date	NULL	YES		NULL		select,insert,update,references	
c2	datetime	NULL	YES		NULL		select,insert,update,references	
c3	timestamp	NULL	YES		NULL		select,insert,update,references	
c4	time	NULL	YES		NULL		select,insert,update,references	
c5	year(4)	NULL	YES		NULL		select,insert,update,references	
INSERT INTO t values ("2000-01-01", "2000-01-01 12:12:12", "2000-01-01 12:12:12", "12:12:12", "2000");
INSERT INTO t values ("2000-02-01", "2000-02-01 12:12:12", "2000-02-01 12:12:12", "13:12:12", 2000);
INSERT INTO t values ("2000-03-01", "2000-03-01", "2000-03-01 12:12:12", "1 12:12:12", 2000);
INSERT INTO t SET c1 = "2000-04-01", c2 = "2000-04-01", c3 = "2000-04-01 12:12:12", c4 = "-1 13:12:12", c5 = 2000;
SELECT * FROM t;
c1	c2	c3	c4	c5
2000-01-01	2000-01-01 12:12:12	2000-01-01 12:12:12	12:12:12	2000
2000-02-01	2000-02-01 12:12:12	2000-02-01 12:12:12	13:12:12	2000
2000-03-01	2000-03-01 00:00:00	2000-03-01 12:12:12	36:12:12	2000
2000-04-01	2000-04-01 00:00:00	2000-04-01 12:12:12	-37:12:12	2000
SELECT c1 FROM t where c1 = "2000-01-01" and "2000-01-01" = c1;
c1
2000-01-01
SELECT c1 FROM t where c1 > "2000-01-01";
c1
2000-02-01
2000-03-01
2000-04-01
SELECT c2 FROM t where c2 < "2000-03-01";
c2
2000-01-01 12:12:12
2000-02-01 12:12:12
SELECT c3 FROM t where c3 != "2000-02-01 12:12:12";
c3
2000-01-01 12:12:12
2000-03-01 12:12:12
2000-04-01 12:12:12
SELECT c4 FROM t where c4 > "13:12:12";
c4
36:12:12
SELECT c4 FROM t where c4 < "-13:12:12";
c4
-37:12:12
SELECT * from t;
c1	c2	c3	c4	c5
2000-01-01	2000-01-01 12:12:12	2000-01-01 12:12:12	12:12:12	2000
2000-02-01	2000-02-01 12:12:12	2000-02-01 12:12:12	13:12:12	2000
2000-03-01	2000-03-01 00:00:00	2000-03-01 12:12:12	36:12:12	2000
2000-04-01	2000-04-01 00:00:00	2000-04-01 12:12:12	-37:12:12	2000
INSERT INTO t values ("2001-01-01", "2000-01-01 12:12:12", "2000-01-01 12:12:12", "12:12:12", "2000");
SELECT * from t WHERE c2 = c3;
c1	c2	c3	c4	c5
2000-01-01	2000-01-01 12:12:12	2000-01-01 12:12:12	12:12:12	2000
2000-02-01	2000-02-01 12:12:12	2000-02-01 12:12:12	13:12:12	2000
2001-01-01	2000-01-01 12:12:12	2000-01-01 12:12:12	12:12:12	2000
set TIMESTAMP = 1234;
select @@timestamp;
@@timestamp
1234
UPDATE t SET c2 = c3 ;
SELECT * from t WHERE c2 = c3;
c1	c2	c3	c4	c5
2000-01-01	2000-01-01 12:12:12	2000-01-01 12:12:12	12:12:12	2000
2000-02-01	2000-02-01 12:12:12	2000-02-01 12:12:12	13:12:12	2000
2000-03-01	2000-03-01 12:12:12	2000-03-01 12:12:12	36:12:12	2000
2000-04-01	2000-04-01 12:12:12	2000-04-01 12:12:12	-37:12:12	2000
2001-01-01	2000-01-01 12:12:12	2000-01-01 12:12:12	12:12:12	2000
set TIMESTAMP = 1235;
select @@timestamp;
@@timestamp
1235
UPDATE t SET c4 = c2 ;
SELECT * from t;
c1	c2	c3	c4	c5
2000-01-01	2000-01-01 12:12:12	2000-01-01 12:12:12	12:12:12	2000
2000-02-01	2000-02-01 12:12:12	2000-02-01 12:12:12	12:12:12	2000
2000-03-01	2000-03-01 12:12:12	2000-03-01 12:12:12	12:12:12	2000
2000-04-01	2000-04-01 12:12:12	2000-04-01 12:12:12	12:12:12	2000
2001-01-01	2000-01-01 12:12:12	2000-01-01 12:12:12	12:12:12	2000
DROP TABLE IF EXISTS t1;
CREATE TABLE t1 (
c1 datetime,
tn varchar(256)
);
INSERT INTO t1 values ("2000-01-01 12:12:12", "");
UPDATE t1 SET tn = c1;
SELECT * from t1;
c1	tn
2000-01-01 12:12:12	2000-01-01 12:12:12
UPDATE t1 SET tn = "2010-01-01 12:12:12";
UPDATE t1 SET c1 = tn;
SELECT * from t1;
c1	tn
2010-01-01 12:12:12	2010-01-01 12:12:12
DELETE from t;
INSERT INTO t values (+20010101, 20010101121212, 20010101121212, "12:12:12", "2000");
SELECT * from t;
c1	c2	c3	c4	c5
2001-01-01	2001-01-01 12:12:12	2001-01-01 12:12:12	12:12:12	2000
INSERT INTO t (c1) values (-1);
Error 1292: Incorrect date value: '-1' for column 'c1' at row 1
INSERT INTO t (c2) values (-1);
Error 1292: Incorrect datetime value: '-1' for column 'c2' at row 1
INSERT INTO t (c3) values (-1);
Error 1292: Incorrect timestamp value: '-1' for column 'c3' at row 1
DELETE from t1;
INSERT INTO t1 (c1) values ("2000-01-01 12:12:12");
set TIMESTAMP = 1236;
select @@timestamp;
@@timestamp
1236
INSERT INTO t (c2) SELECT c1 from t1;
SELECT * from t;
c1	c2	c3	c4	c5
2001-01-01	2001-01-01 12:12:12	2001-01-01 12:12:12	12:12:12	2000
NULL	2000-01-01 12:12:12	NULL	NULL	NULL
DROP TABLE IF EXISTS t;
CREATE TABLE t (c1 timestamp unique);
INSERT INTO t values ("2000-01-01 12:12:12"), ("2000-02-01 12:12:13"), ("2000-02-01 12:12:14"), ("2000-03-01 12:12:15");
SELECT c1 FROM t where c1 > "2000-01-02";
c1
2000-02-01 12:12:13
2000-02-01 12:12:14
2000-03-01 12:12:15
DROP TABLE t;
CREATE TABLE t(a int primary key, b timestamp);
INSERT INTO t VALUES(1, '2000-01-01 12:12:12');
SELECT * FROM t WHERE b = (SELECT max(b) FROM t);
a	b
1	2000-01-01 12:12:12
drop table t;
create table t (col datetime);
insert into t values ('2004-04-31');
Error 1292: Incorrect datetime value: '2004-04-31' for column 'col' at row 1
set sql_mode = 'ALLOW_INVALID_DATES';
insert into t values ('2004-04-31');
select * from t;
col
2004-04-31 00:00:00
set sql_mode = 'ONLY_FULL_GROUP_BY,STRICT_TRANS_TABLES,NO_ZERO_IN_DATE,NO_ZERO_DATE,ERROR_FOR_DIVISION_BY_ZERO,NO_AUTO_CREATE_USER,NO_ENGINE_SUBSTITUTION';
select * from t;
col
2004-04-31 00:00:00
drop table t;
set sql_mode = 'ALLOW_INVALID_DATES';
create table t(c varchar(100));
insert into t values ('2020-02-30');
select date_format(c, '%d') from t;
date_format(c, '%d')
30
set sql_mode = 'ONLY_FULL_GROUP_BY,STRICT_TRANS_TABLES,NO_ZERO_IN_DATE,NO_ZERO_DATE,ERROR_FOR_DIVISION_BY_ZERO,NO_AUTO_CREATE_USER,NO_ENGINE_SUBSTITUTION';
select date_format(c, '%d') from t;
date_format(c, '%d')
NULL
